{
  "name": "a5_description",
  "display_name": "A5 Description",
  "description": "Here are the ROS simulation packages for Unitree robots, You can load robots and joint controllers in Gazebo, so you can perform low-level control (control the torque, position and angular velocity) of the robot joints. Please be aware that the Gazebo simulation cannot do high-level control, namely ",
  "version": "1.0.0",
  "arsenal_version": "1",
  "source": "https://github.com/unitreerobotics/unitree_ros/tree/master/robots",
  "license": "BSD-3-Clause",
  "authors": [
    "HangZhou YuShu TECHNOLOGY CO.,LTD. (Unitree Robotics)"
  ],
  "maintainers": [
    "BulletLab Forge"
  ],
  "tags": [
    "ros",
    "gazebo",
    "simulation",
    "robot-description",
    "joint-controller",
    "low-level-control",
    "unitree"
  ],
  "minimum_bulletlab_version": ">=0.1.0",
  "models": [
    {
      "id": "a5",
      "display_name": "A5",
      "entrypoint": "urdf/A5.urdf",
      "description": "Generated from A5.urdf",
      "default": true
    }
  ]
}