{
  "name": "h2_description",
  "display_name": "H2 Description",
  "description": "Here are the ROS simulation packages for Unitree robots, You can load robots and joint controllers in Gazebo, so you can perform low-level control (control the torque, position and angular velocity) of the robot joints. Please be aware that the Gazebo simulation cannot do high-level control, namely ",
  "version": "1.0.0",
  "arsenal_version": "1",
  "source": "https://github.com/unitreerobotics/unitree_ros/tree/master/robots",
  "license": "BSD-3-Clause",
  "authors": [
    "HangZhou YuShu TECHNOLOGY CO.,LTD.",
    "Unitree Robotics"
  ],
  "maintainers": [
    "BulletLab Forge"
  ],
  "tags": [
    "ros",
    "gazebo",
    "simulation",
    "robot-description",
    "controller",
    "unitree"
  ],
  "minimum_bulletlab_version": ">=0.1.0",
  "models": [
    {
      "id": "h2",
      "display_name": "H2",
      "entrypoint": "urdf/H2.urdf",
      "description": "Generated from H2.urdf",
      "default": true
    },
    {
      "id": "h2_dae",
      "display_name": "H2 dae",
      "entrypoint": "urdf/H2_dae.urdf",
      "description": "Generated from H2_dae.urdf",
      "default": false
    }
  ]
}