{
  "name": "g1_with_brainco_hand",
  "display_name": "G1 With Brainco Hand",
  "description": "Here are the ROS simulation packages for Unitree robots, You can load robots and joint controllers in Gazebo, so you can perform low-level control (control the torque, position and angular velocity) of the robot joints. Please be aware that the Gazebo simulation cannot do high-level control, namely ",
  "version": "1.0.0",
  "arsenal_version": "1",
  "source": "https://github.com/unitreerobotics/unitree_ros/tree/master/robots",
  "license": "BSD-3-Clause",
  "authors": [
    "HangZhou YuShu TECHNOLOGY CO.,LTD."
  ],
  "maintainers": [
    "BulletLab Forge"
  ],
  "tags": [
    "ros",
    "gazebo",
    "simulation",
    "robot-description",
    "controller",
    "unitree"
  ],
  "minimum_bulletlab_version": ">=0.1.0",
  "models": [
    {
      "id": "g1_29dof_mode_15_brainco_hand",
      "display_name": "g1 29dof mode 15 brainco hand",
      "entrypoint": "urdf/g1_29dof_mode_15_brainco_hand.urdf",
      "description": "Generated from g1_29dof_mode_15_brainco_hand.urdf",
      "default": true
    }
  ]
}