{
  "name": "b2w_description",
  "display_name": "B2W Description",
  "description": "Here are the ROS simulation packages for Unitree robots, You can load robots and joint controllers in Gazebo, so you can perform low-level control (control the torque, position and angular velocity) of the robot joints. Please be aware that the Gazebo simulation cannot do high-level control, namely ",
  "version": "1.0.0",
  "arsenal_version": "1",
  "source": "https://github.com/unitreerobotics/unitree_ros/tree/master/robots",
  "license": "BSD-3-Clause",
  "authors": [
    "TODO"
  ],
  "maintainers": [
    "BulletLab Forge",
    " <TODO@email.com>"
  ],
  "tags": [
    "ros",
    "gazebo",
    "robot-description",
    "b2w",
    "quadruped",
    "simulation",
    "unitree"
  ],
  "minimum_bulletlab_version": ">=0.1.0",
  "models": [
    {
      "id": "b2w_description",
      "display_name": "b2w description",
      "entrypoint": "urdf/b2w_description.urdf",
      "description": "Generated from b2w_description.urdf",
      "default": true
    },
    {
      "id": "robot",
      "display_name": "robot",
      "entrypoint": "urdf/robot.urdf",
      "description": "Generated from robot.xacro",
      "default": false
    }
  ]
}