{
  "name": "dex1_1",
  "display_name": "Dex1 1",
  "description": "Here are the ROS simulation packages for Unitree robots, You can load robots and joint controllers in Gazebo, so you can perform low-level control (control the torque, position and angular velocity) of the robot joints. Please be aware that the Gazebo simulation cannot do high-level control, namely ",
  "version": "1.0.0",
  "arsenal_version": "1",
  "source": "https://github.com/unitreerobotics/unitree_ros/tree/master/robots",
  "license": "BSD-3-Clause",
  "authors": [
    "Unitree Robotics"
  ],
  "maintainers": [
    "BulletLab Forge"
  ],
  "tags": [
    "dexterous-hand",
    "urdf",
    "robot-description"
  ],
  "minimum_bulletlab_version": ">=0.1.0",
  "models": [
    {
      "id": "dex1_1",
      "display_name": "dex1 1",
      "entrypoint": "urdf/dex1_1.urdf",
      "description": "Generated from dex1_1.urdf",
      "default": true
    }
  ]
}